{
  "schema_version": "v1",
  "groups": [
    { "id": "face",  "display_name": { "en": "Face",   "ko": "얼굴",   "ja": "顔" } },
    { "id": "eyes",  "display_name": { "en": "Eyes",   "ko": "눈",     "ja": "目" } },
    { "id": "brows", "display_name": { "en": "Brows",  "ko": "눈썹",   "ja": "眉" } },
    { "id": "mouth", "display_name": { "en": "Mouth",  "ko": "입",     "ja": "口" } },
    { "id": "body",  "display_name": { "en": "Body",   "ko": "몸",     "ja": "体" } },
    { "id": "hair",  "display_name": { "en": "Hair",   "ko": "머리",   "ja": "髪" } },
    { "id": "overall", "display_name": { "en": "Overall", "ko": "전체", "ja": "全体" } }
  ],
  "combined_axes": [
    ["head_angle_x", "head_angle_y"],
    ["overall_x", "overall_y"]
  ],
  "parameters": [
    {
      "id": "head_angle_x",
      "display_name": { "en": "Head Angle X", "ko": "머리 좌우 회전", "ja": "頭 角度 X" },
      "unit": "degree",
      "range": [-30, 30],
      "default": 0,
      "required": true,
      "group": "face",
      "channel": "core",
      "cubism": "ParamAngleX",
      "physics_input": true
    },
    {
      "id": "head_angle_y",
      "display_name": { "en": "Head Angle Y", "ko": "머리 상하 회전", "ja": "頭 角度 Y" },
      "unit": "degree",
      "range": [-30, 30],
      "default": 0,
      "required": true,
      "group": "face",
      "channel": "core",
      "cubism": "ParamAngleY"
    },
    {
      "id": "head_angle_z",
      "display_name": { "en": "Head Angle Z", "ko": "머리 기울기", "ja": "頭 角度 Z" },
      "unit": "degree",
      "range": [-30, 30],
      "default": 0,
      "required": true,
      "group": "face",
      "channel": "core",
      "cubism": "ParamAngleZ",
      "physics_input": true
    },
    {
      "id": "body_angle_x",
      "display_name": { "en": "Body Angle X", "ko": "상반신 좌우", "ja": "体 角度 X" },
      "unit": "degree",
      "range": [-10, 10],
      "default": 0,
      "required": true,
      "group": "body",
      "channel": "core",
      "cubism": "ParamBodyAngleX",
      "physics_input": true
    },
    {
      "id": "body_angle_y",
      "display_name": { "en": "Body Angle Y", "ko": "상반신 상하", "ja": "体 角度 Y" },
      "unit": "degree",
      "range": [-10, 10],
      "default": 0,
      "required": true,
      "group": "body",
      "channel": "core",
      "cubism": "ParamBodyAngleY"
    },
    {
      "id": "body_angle_z",
      "display_name": { "en": "Body Angle Z", "ko": "상반신 기울기", "ja": "体 角度 Z" },
      "unit": "degree",
      "range": [-10, 10],
      "default": 0,
      "required": true,
      "group": "body",
      "channel": "core",
      "cubism": "ParamBodyAngleZ",
      "physics_input": true
    },
    {
      "id": "body_breath",
      "display_name": { "en": "Breath", "ko": "호흡", "ja": "呼吸" },
      "unit": "normalized",
      "range": [0, 1],
      "default": 0,
      "required": true,
      "group": "body",
      "channel": "core",
      "cubism": "ParamBreath",
      "physics_input": true,
      "notes": "idle.default 모션이 주 입력. 물리 입력으로도 사용됨."
    },
    {
      "id": "arm_pose_variant",
      "display_name": { "en": "Arm Pose Variant", "ko": "팔 포즈 variant", "ja": "腕 ポーズ" },
      "unit": "normalized",
      "range": [0, 1],
      "default": 0,
      "required": true,
      "group": "body",
      "channel": "core",
      "cubism": "ParamArmPoseVariant",
      "notes": "0=A (중립), 1=B (교체 포즈). Pose3 mutex 로 A/B 파츠 동시 노출 방지. docs/03 §12.1 #3."
    },
    {
      "id": "arm_l_angle",
      "display_name": { "en": "Arm Angle (L)", "ko": "왼팔 각도", "ja": "左腕 角度" },
      "unit": "degree",
      "range": [-30, 30],
      "default": 0,
      "required": true,
      "group": "body",
      "channel": "core",
      "cubism": "ParamArmLAngle",
      "notes": "캐릭터 왼팔 회전. arm_l_warp 의 주 입력. greet.wave 포함 제스처 모션에서 사용."
    },
    {
      "id": "arm_r_angle",
      "display_name": { "en": "Arm Angle (R)", "ko": "오른팔 각도", "ja": "右腕 角度" },
      "unit": "degree",
      "range": [-30, 30],
      "default": 0,
      "required": true,
      "group": "body",
      "channel": "core",
      "cubism": "ParamArmRAngle"
    },
    {
      "id": "cloth_main_fuwa",
      "display_name": { "en": "Cloth Main Fuwa", "ko": "상의 부풀림", "ja": "衣装 フワ" },
      "unit": "normalized",
      "range": [0, 1],
      "default": 0,
      "required": false,
      "group": "body",
      "channel": "extension",
      "cubism": "ParamClothMainFuwa",
      "physics_output": true,
      "notes": "body_breath 기반 의상 볼륨 팽창. body_angle_x 가 방향 수정자. docs/03 §12.1 #1."
    },
    {
      "id": "eye_open_l",
      "display_name": { "en": "Eye Open (L)", "ko": "왼눈 개폐", "ja": "左目 開閉" },
      "unit": "normalized",
      "range": [0, 1],
      "default": 1,
      "required": true,
      "group": "eyes",
      "channel": "core",
      "cubism": "ParamEyeLOpen",
      "notes": "1=완전 열림. EyeBlink 그룹 멤버."
    },
    {
      "id": "eye_open_r",
      "display_name": { "en": "Eye Open (R)", "ko": "오른눈 개폐", "ja": "右目 開閉" },
      "unit": "normalized",
      "range": [0, 1],
      "default": 1,
      "required": true,
      "group": "eyes",
      "channel": "core",
      "cubism": "ParamEyeROpen"
    },
    {
      "id": "eye_smile_l",
      "display_name": { "en": "Eye Smile (L)", "ko": "왼눈웃음", "ja": "左目 笑顔" },
      "unit": "normalized",
      "range": [0, 1],
      "default": 0,
      "required": true,
      "group": "eyes",
      "channel": "core",
      "cubism": "ParamEyeLSmile"
    },
    {
      "id": "eye_smile_r",
      "display_name": { "en": "Eye Smile (R)", "ko": "오른눈웃음", "ja": "右目 笑顔" },
      "unit": "normalized",
      "range": [0, 1],
      "default": 0,
      "required": true,
      "group": "eyes",
      "channel": "core",
      "cubism": "ParamEyeRSmile"
    },
    {
      "id": "eye_form_l",
      "display_name": { "en": "Eye Form (L)", "ko": "왼눈 형태", "ja": "左目 形" },
      "unit": "normalized",
      "range": [-1, 1],
      "default": 0,
      "required": true,
      "group": "eyes",
      "channel": "core",
      "cubism": "ParamEyeLForm"
    },
    {
      "id": "eye_form_r",
      "display_name": { "en": "Eye Form (R)", "ko": "오른눈 형태", "ja": "右目 形" },
      "unit": "normalized",
      "range": [-1, 1],
      "default": 0,
      "required": true,
      "group": "eyes",
      "channel": "core",
      "cubism": "ParamEyeRForm"
    },
    {
      "id": "eye_ball_x",
      "display_name": { "en": "Eye Ball X", "ko": "시선 좌우", "ja": "視線 X" },
      "unit": "normalized",
      "range": [-1, 1],
      "default": 0,
      "required": true,
      "group": "eyes",
      "channel": "core",
      "cubism": "ParamEyeBallX"
    },
    {
      "id": "eye_ball_y",
      "display_name": { "en": "Eye Ball Y", "ko": "시선 상하", "ja": "視線 Y" },
      "unit": "normalized",
      "range": [-1, 1],
      "default": 0,
      "required": true,
      "group": "eyes",
      "channel": "core",
      "cubism": "ParamEyeBallY"
    },
    {
      "id": "eye_ball_form",
      "display_name": { "en": "Eye Ball Form", "ko": "동공 축소", "ja": "瞳孔 形" },
      "unit": "normalized",
      "range": [0, 1],
      "default": 0,
      "required": false,
      "group": "eyes",
      "channel": "extension",
      "cubism": "ParamEyeBallForm"
    },
    {
      "id": "brow_l_y",
      "display_name": { "en": "Brow Y (L)", "ko": "왼눈썹 상하", "ja": "左眉 Y" },
      "unit": "normalized",
      "range": [-1, 1],
      "default": 0,
      "required": true,
      "group": "brows",
      "channel": "core",
      "cubism": "ParamBrowLY"
    },
    {
      "id": "brow_r_y",
      "display_name": { "en": "Brow Y (R)", "ko": "오른눈썹 상하", "ja": "右眉 Y" },
      "unit": "normalized",
      "range": [-1, 1],
      "default": 0,
      "required": true,
      "group": "brows",
      "channel": "core",
      "cubism": "ParamBrowRY"
    },
    {
      "id": "brow_l_x",
      "display_name": { "en": "Brow X (L)", "ko": "왼눈썹 좌우", "ja": "左眉 X" },
      "unit": "normalized",
      "range": [-1, 1],
      "default": 0,
      "required": false,
      "group": "brows",
      "channel": "extension",
      "cubism": "ParamBrowLX"
    },
    {
      "id": "brow_r_x",
      "display_name": { "en": "Brow X (R)", "ko": "오른눈썹 좌우", "ja": "右眉 X" },
      "unit": "normalized",
      "range": [-1, 1],
      "default": 0,
      "required": false,
      "group": "brows",
      "channel": "extension",
      "cubism": "ParamBrowRX"
    },
    {
      "id": "brow_l_angle",
      "display_name": { "en": "Brow Angle (L)", "ko": "왼눈썹 기울기", "ja": "左眉 角度" },
      "unit": "normalized",
      "range": [-1, 1],
      "default": 0,
      "required": true,
      "group": "brows",
      "channel": "core",
      "cubism": "ParamBrowLAngle"
    },
    {
      "id": "brow_r_angle",
      "display_name": { "en": "Brow Angle (R)", "ko": "오른눈썹 기울기", "ja": "右眉 角度" },
      "unit": "normalized",
      "range": [-1, 1],
      "default": 0,
      "required": true,
      "group": "brows",
      "channel": "core",
      "cubism": "ParamBrowRAngle"
    },
    {
      "id": "brow_l_form",
      "display_name": { "en": "Brow Form (L)", "ko": "왼눈썹 형태", "ja": "左眉 形" },
      "unit": "normalized",
      "range": [-1, 1],
      "default": 0,
      "required": false,
      "group": "brows",
      "channel": "extension",
      "cubism": "ParamBrowLForm"
    },
    {
      "id": "brow_r_form",
      "display_name": { "en": "Brow Form (R)", "ko": "오른눈썹 형태", "ja": "右眉 形" },
      "unit": "normalized",
      "range": [-1, 1],
      "default": 0,
      "required": false,
      "group": "brows",
      "channel": "extension",
      "cubism": "ParamBrowRForm"
    },
    {
      "id": "mouth_vowel_a",
      "display_name": { "en": "Mouth A", "ko": "모음 A", "ja": "母音 A" },
      "unit": "normalized",
      "range": [0, 1],
      "default": 0,
      "required": true,
      "group": "mouth",
      "channel": "core",
      "cubism": "ParamA",
      "notes": "LipSync 그룹 대표 입력 (간이 모드 호환)."
    },
    {
      "id": "mouth_vowel_i",
      "display_name": { "en": "Mouth I", "ko": "모음 I", "ja": "母音 I" },